{
  "submittedOn": "2021-06-17T10:59:47.544Z",
  "fromDate": "2020-01-01",
  "toDate": "2020-01-31",
  "foreignFhlEea": {
    "income": {
      "rentAmount": 200.22
    },
    "expenses": {
      "consolidatedExpenses": 100.25
    }
  },
  "foreignNonFhlProperty": [
    {
      "countryCode": "FRA",
      "income": {
        "rentIncome": {
          "rentAmount": 200.22
        },
        "foreignTaxCreditRelief": true,
        "premiumsOfLeaseGrant": 100.25,
        "otherPropertyIncome": 100.25,
        "foreignTaxPaidOrDeducted": 44.21,
        "specialWithholdingTaxOrUkTaxPaid": 23.78
      },
      "expenses": {
        "residentialFinancialCost": 200.25,
        "broughtFwdResidentialFinancialCost": 100.25,
        "consolidatedExpenses": 100.25
      }
    }
  ]
}